เลขทะเบียนสมาชิก,เลขที่สัญญา,ชื่อ-นามสกุล,สังกัด,วันที่สัญญา
1,สร6301131,นางหนึ่ง สองสาม,บำนาญ อ.นาน้อย,6/11/2020
1,สม5502952,นางหนึ่ง สองสาม,บำนาญ อ.นาน้อย,06/22/2012
2,สม6701021,นางสี่ ห้าหก,บำนาญ อ.นาน้อย,8/10/2024
3,สม6500767,นายทดสอบ ฮ่าฮ่า,บำนาญ อ.นาน้อย,08/23/2022
3,สอ5801287,นายทดสอบ ฮ่าฮ่า,บำนาญ อ.นาน้อย,8/11/2015
4,สม5502983,นางทดสอบ สองสาม,บำนาญ อ.ท่าวังผา,06/22/2012
5,สห6400318,นางโหล เทสเทส,บำนาญ อ.เวียงสา,3/3/2021
6,สม6701417,นางไวไว ควิก,บำนาญ อ.เชียงกลาง,11/16/2024
6,สว6500386,นางไวไว ควิก,บำนาญ อ.เชียงกลาง,02/21/2022
7,สอ5900753,นางมีมั้ย ชื่อนี้,บำนาญ อ.เมืองน่าน,07/15/2016
7,สม5700934,นางมีมั้ย ชื่อนี้,บำนาญ อ.เมืองน่าน,03/21/2014
8,สห6500056,นายมั่ว มั่วชื่อ,บำนาญ อ.ปัว,1/5/2022
9,สห6800044,นางอะไร คิดไม่ออก,บำนาญ  อ.ภูเพียง,7/3/2025
9,สว6701850,นางอะไร คิดไม่ออก,บำนาญ  อ.ภูเพียง,10/8/2024
10,สม6100195,นางเว็บไซต์ สหกรณ์,บำนาญ อ.เวียงสา,01/16/2018
10,สช6800940,นางเว็บไซต์ สหกรณ์,บำนาญ อ.เวียงสา,07/18/2025
